{
  "act_version": "0.1",
  "site": {
    "name": "Acme Knowledge Base",
    "description": "Internal handbook backed by Notion, mirrored to ACT (Agent Content Tree) for AI-agent consumption.",
    "canonical_url": "http://localhost:8083"
  },
  "generated_at": "1970-01-01T00:00:00.000Z",
  "generator": "@act-spec/example-notion-knowledge-base@0.2.0",
  "index_url": "/act/index.json",
  "node_url_template": "/act/nodes/{id}.json",
  "subtree_url_template": "/act/subtrees/{id}.json",
  "root_id": "kb/11111111-1111-4111-8111-111111111111",
  "capabilities": {
    "etag": true,
    "subtree": true
  },
  "conformance": {
    "level": "standard"
  },
  "delivery": "static",
  "stats": {
    "node_count": 6
  }
}